"Saul is pretty good, but definitely not great.",Saul,neutral,0,4,food,positive,689,,,,,,,,,,,,,,,,,,,,,,,,,,,,,,,,,,,,,,
"I would recommend Roxy's for that, but not for their food.",food,negative,53,57,food,negative,3580,anecdotes/miscellaneous,positive,,,,,,,,,,,,,,,,,,,,,,,,,,,,,,,,,,,,
We always get a sampling of appetizers and share.,appetizers,neutral,28,38,anecdotes/miscellaneous,neutral,3524,,,,,,,,,,,,,,,,,,,,,,,,,,,,,,,,,,,,,,
"Overall I was impressed and will return, it's a great QPR (Quality to Price Ratio).",Price,positive,70,75,anecdotes/miscellaneous,positive,510,price,positive,Quality,positive,59,66,,,,,,,,,,,,,,,,,,,,,,,,,,,,,,,,
"It is nearly impossible to get a table, so if you ever have the chance to go here for dinner, DO NOT pass it up.",table,negative,33,38,anecdotes/miscellaneous,conflict,600,,,dinner,positive,86,92,,,,,,,,,,,,,,,,,,,,,,,,,,,,,,,,
Their pad penang is delicious and everything else is fantastic.,pad penang,positive,6,16,food,positive,424,,,,,,,,,,,,,,,,,,,,,,,,,,,,,,,,,,,,,,
"The puke green walls leave a lot to be desired, but the food is very good.",food,positive,56,60,food,positive,3091,ambience,negative,walls,negative,15,20,,,,,,,,,,,,,,,,,,,,,,,,,,,,,,,,
"The flavors are very fresh and pretty inobtrusive, nothing flashy.",flavors,positive,4,11,food,positive,676,,,,,,,,,,,,,,,,,,,,,,,,,,,,,,,,,,,,,,
"I like Cafe Noir dont get me wrong, it is jsut that the people who work there are evil and incompetent!!",people,negative,56,62,service,negative,7,,,,,,,,,,,,,,,,,,,,,,,,,,,,,,,,,,,,,,
The hanger steak was like rubber and the tuna was flavorless not to mention it tasted like it had just been thawed.,hanger steak,negative,4,16,food,negative,1371,,,tuna,negative,41,45,,,,,,,,,,,,,,,,,,,,,,,,,,,,,,,,
But $1 for each small piece???,,,,,price,negative,2091,,,,,,,,,,,,,,,,,,,,,,,,,,,,,,,,,,,,,,
"Our son loves pizza and we have a certified Neapolitan pizzaria in our home city (Seattle), we liked this nearly as much - and the differences were more about personal preference than any reflection on either restaurant.",pizza,positive,14,19,anecdotes/miscellaneous,positive,1596,,,,,,,,,,,,,,,,,,,,,,,,,,,,,,,,,,,,,,
big and soft as well as good lunch food.,lunch food,positive,29,39,food,positive,1232,,,,,,,,,,,,,,,,,,,,,,,,,,,,,,,,,,,,,,
"No food snobs allowed, this place is for people who appreciate good food.",food,neutral,3,7,anecdotes/miscellaneous,neutral,967,food,positive,food,positive,68,72,,,,,,,,,,,,,,,,,,,,,,,,,,,,,,,,
I liked the food at this quasi-thai restaurant.,food,positive,12,16,food,positive,1127,,,quasi-thai,positive,25,35,,,,,,,,,,,,,,,,,,,,,,,,,,,,,,,,
By far the best salad I have had in a fast food restaurant.,salad,positive,16,21,food,positive,2576,,,fast food,neutral,38,47,,,,,,,,,,,,,,,,,,,,,,,,,,,,,,,,
Suan is a great place that I often take my friends (classmates) too.,,,,,anecdotes/miscellaneous,positive,2242,,,,,,,,,,,,,,,,,,,,,,,,,,,,,,,,,,,,,,
Not a great place for family or general dining.,,,,,anecdotes/miscellaneous,negative,2650,,,,,,,,,,,,,,,,,,,,,,,,,,,,,,,,,,,,,,
"As for the bar, this is another bad idea.",bar,negative,11,14,food,negative,2529,,,,,,,,,,,,,,,,,,,,,,,,,,,,,,,,,,,,,,
"Their bagels are fine, but they are a little overcooked, and not really a 'special' bagel experience.",bagels,conflict,6,12,food,conflict,3167,,,bagel,neutral,84,89,,,,,,,,,,,,,,,,,,,,,,,,,,,,,,,,
"Unlike HH up the block, this place actually gives you hearty and hot bagels this town is known for.",bagels,positive,69,75,food,positive,1217,,,,,,,,,,,,,,,,,,,,,,,,,,,,,,,,,,,,,,
I thought going to Jimmys would give me a real Domincan exprience.,,,,,anecdotes/miscellaneous,neutral,1149,,,,,,,,,,,,,,,,,,,,,,,,,,,,,,,,,,,,,,
The barebecued salmon is elegantly spiced and not at all dry.,barebecued salmon,positive,4,21,food,positive,2644,,,,,,,,,,,,,,,,,,,,,,,,,,,,,,,,,,,,,,
"Same owner as the guy who owns Typhoon, which is just down the street on St. Marks and 1st Ave.",owner,neutral,5,10,anecdotes/miscellaneous,neutral,2812,,,,,,,,,,,,,,,,,,,,,,,,,,,,,,,,,,,,,,
What generous portions!,portions,positive,14,22,food,positive,1028,,,,,,,,,,,,,,,,,,,,,,,,,,,,,,,,,,,,,,
The workers there also absolutely load the bagel with cream cheese (gets a little messy).,workers,neutral,4,11,food,neutral,2167,,,bagel,neutral,43,48,cream cheese,neutral,54,66,,,,,,,,,,,,,,,,,,,,,,,,,,,,
I was wrong.,,,,,anecdotes/miscellaneous,negative,795,,,,,,,,,,,,,,,,,,,,,,,,,,,,,,,,,,,,,,
The wine the service was very good too.,wine,positive,4,8,food,positive,573,service,positive,service,positive,13,20,,,,,,,,,,,,,,,,,,,,,,,,,,,,,,,,
"So, the menu is written in chalk above your head and it all sounds delicious.",menu,neutral,8,12,food,positive,1082,ambience,positive,,,,,,,,,,,,,,,,,,,,,,,,,,,,,,,,,,,,
The highly spiced chai tea was great too.,chai tea,positive,18,26,food,positive,1080,,,,,,,,,,,,,,,,,,,,,,,,,,,,,,,,,,,,,,
No plans to return anytime soon.,,,,,anecdotes/miscellaneous,negative,2929,,,,,,,,,,,,,,,,,,,,,,,,,,,,,,,,,,,,,,
"I have been there many times, and food is good and consistent.",food,positive,34,38,food,positive,752,,,,,,,,,,,,,,,,,,,,,,,,,,,,,,,,,,,,,,
"Seriously, this is the best all you can eat in town- As everyone says, the Spicy Tuna hand rolls are the best- have 4 of these, and you've broken even.",Spicy Tuna hand rolls,positive,75,96,food,positive,1641,,,,,,,,,,,,,,,,,,,,,,,,,,,,,,,,,,,,,,
There is not a single place in Chinatown where you have a nice neighborhood feeling like here.,,,,,ambience,positive,3257,,,,,,,,,,,,,,,,,,,,,,,,,,,,,,,,,,,,,,
"While Sapphire is certainly not lacking in ambiance, and probably has the best decor of any Indian restaurant I have been to in New York City, the food was not what I had hoped for.",food,negative,147,151,food,negative,2897,ambience,positive,ambiance,positive,43,51,decor,positive,79,84,,,,,,,,,,,,,,,,,,,,,,,,,,,,
I would highly recommend this place to anyone looking for a casual atmosphere that whisks you away to the left bank of the river Seine.,atmosphere,positive,67,77,anecdotes/miscellaneous,positive,872,ambience,positive,,,,,,,,,,,,,,,,,,,,,,,,,,,,,,,,,,,,
I just do not understand what the fuss is all about.,,,,,anecdotes/miscellaneous,negative,2828,,,,,,,,,,,,,,,,,,,,,,,,,,,,,,,,,,,,,,
The meat dishes were only so-so.,meat dishes,neutral,4,15,food,neutral,2086,,,,,,,,,,,,,,,,,,,,,,,,,,,,,,,,,,,,,,
"His wife Tanya, the hostess, completes the comforting atmosphere by being delightfully warm and gracious.",hostess,positive,20,27,service,positive,3507,ambience,positive,atmosphere,positive,54,64,,,,,,,,,,,,,,,,,,,,,,,,,,,,,,,,
"We liked it so much, that we will always make it a point to dine here when we visit New York.",,,,,anecdotes/miscellaneous,positive,635,,,,,,,,,,,,,,,,,,,,,,,,,,,,,,,,,,,,,,
"The menu consisted of standard brassiere food, better then places like Balthazar etc.",menu,positive,4,8,food,positive,957,,,brassiere food,positive,31,45,,,,,,,,,,,,,,,,,,,,,,,,,,,,,,,,
"I have been a longtime fan of Holy Basil in the East Village, and while I do believe their food has slightly slipped in quality, I have been hesitant to be disloyal.",food,negative,91,95,anecdotes/miscellaneous,neutral,2249,food,negative,quality,negative,120,127,,,,,,,,,,,,,,,,,,,,,,,,,,,,,,,,
"But the best part about LS is the late night atmosphere, delightfully free of the BTs.",atmosphere,positive,45,55,ambience,positive,1724,,,,,,,,,,,,,,,,,,,,,,,,,,,,,,,,,,,,,,
For an untrendy rip-off- eat here.,,,,,anecdotes/miscellaneous,negative,761,,,,,,,,,,,,,,,,,,,,,,,,,,,,,,,,,,,,,,
And you're hungry a few hours later.,,,,,food,neutral,1640,,,,,,,,,,,,,,,,,,,,,,,,,,,,,,,,,,,,,,
I can't wait to go back.,,,,,anecdotes/miscellaneous,positive,2322,,,,,,,,,,,,,,,,,,,,,,,,,,,,,,,,,,,,,,
I HATE HATE HATE this place.,,,,,anecdotes/miscellaneous,negative,3476,,,,,,,,,,,,,,,,,,,,,,,,,,,,,,,,,,,,,,
We even had a visit from the Manager who wanted to make sure we were enjoying ourselves.,Manager,positive,29,36,anecdotes/miscellaneous,positive,2080,service,positive,,,,,,,,,,,,,,,,,,,,,,,,,,,,,,,,,,,,
The staff there is very attentive and down to earth.,staff,positive,4,9,service,positive,866,,,,,,,,,,,,,,,,,,,,,,,,,,,,,,,,,,,,,,
"You don't go to Mizu for excellent service, you go for the large amounts of food, the amiable atmosphere, and the hole-in-the-wall feeling of the place.",service,negative,35,42,food,positive,1031,service,negative,food,positive,76,80,atmosphere,positive,94,104,,,,,,,,,,,,,,,,,ambience,positive,,,,,,,,,,
"The service is always bad though, don't expect much of anything from your server, and I would not recommend bringing a date here either.",service,negative,4,11,service,negative,712,,,server,negative,74,80,,,,,,,,,,,,,,,,,,,,,,,,,,,,,,,,
Monday nights are a bargain at the $28 prix fix - this includes a three course meal plus *three* glasses of wine paired with each course.,prix fix,positive,39,47,price,positive,3226,,,three course meal,positive,66,83,glasses of wine,positive,97,112,course,neutral,130,136,,,,,,,,,,,,,,,,,,,,,,,,
Wonderful!,,,,,anecdotes/miscellaneous,positive,3093,,,,,,,,,,,,,,,,,,,,,,,,,,,,,,,,,,,,,,
It took them 15 minutes to put water in our glasses.,water,neutral,31,36,service,negative,931,,,,,,,,,,,,,,,,,,,,,,,,,,,,,,,,,,,,,,
The service is descent even when this small place is packed.,service,positive,4,11,service,positive,979,,,place,negative,44,49,,,,,,,,,,,,,,,,,,,,,,,,,,,,,,,,
This is the best sushi in new york city - hands down.,sushi,positive,17,22,food,positive,1205,,,,,,,,,,,,,,,,,,,,,,,,,,,,,,,,,,,,,,
Go hungry and enjoy.,,,,,anecdotes/miscellaneous,positive,1414,,,,,,,,,,,,,,,,,,,,,,,,,,,,,,,,,,,,,,
I have eaten a lot of pizza here.,pizza,neutral,22,27,anecdotes/miscellaneous,neutral,3603,,,,,,,,,,,,,,,,,,,,,,,,,,,,,,,,,,,,,,
This place is worth an one-hour drive.,,,,,anecdotes/miscellaneous,positive,2809,,,,,,,,,,,,,,,,,,,,,,,,,,,,,,,,,,,,,,
Great value for the quality ingredients.,ingredients,positive,28,39,food,positive,2567,price,positive,,,,,,,,,,,,,,,,,,,,,,,,,,,,,,,,,,,,
"The Thali was small, thoroughly unremarkable, and $14.95.",Thali,negative,4,9,food,negative,1419,price,negative,,,,,,,,,,,,,,,,,,,,,,,,,,,,,,,,,,,,
The sushi is also great!,sushi,positive,4,9,food,positive,305,,,,,,,,,,,,,,,,,,,,,,,,,,,,,,,,,,,,,,
From the complimentary chef app of a delicate butternut squash ravioli in a delicious truffle sauce to an amazing buttery and tender langostine entree to a dessert that I can't remember because of the fabulous Cakebread Cabernet we were drinking -- the whole evening was amazing.,chef app,positive,23,31,food,positive,2843,,,delicate butternut squash ravioli in a delicious truffle sauce,positive,37,99,buttery and tender langostine entree,positive,114,150,dessert,neutral,156,163,Cakebread Cabernet,positive,210,228,,,,,,,,,,,,,,,,,,,,
Truly the mark of an attentive waiter.,waiter,positive,31,37,service,positive,1931,,,,,,,,,,,,,,,,,,,,,,,,,,,,,,,,,,,,,,
"The food here is rather good, but only if you like to wait for it.",food,positive,4,8,food,positive,181,service,negative,,,,,,,,,,,,,,,,,,,,,,,,,,,,,,,,,,,,
I got an excellent piece of cheesecake and we had several other nice pastries.,cheesecake,positive,28,38,food,positive,3579,,,pastries,positive,69,77,,,,,,,,,,,,,,,,,,,,,,,,,,,,,,,,
"The staff is very kind and well trained, they're fast, they are always prompt to jump behind the bar and fix drinks, they know details of every item in the menu and make excelent recomendations.",staff,positive,4,9,service,positive,2455,,,bar,neutral,97,100,drinks,neutral,109,115,menu,neutral,156,160,,,,,,,,,,,,,,,,,,,,,,,,
The makhani was OK --the korma was bland.,makhani,neutral,4,11,food,negative,2040,,,korma,negative,25,30,,,,,,,,,,,,,,,,,,,,,,,,,,,,,,,,
The food is inventive but still keeps traditional indian flavoring.,food,positive,4,8,food,positive,3080,,,,,,,,,,,,,,,,,,,,,,,,,,,,,,,,,,,,,,
All I can say is WOW!,,,,,anecdotes/miscellaneous,positive,2849,,,,,,,,,,,,,,,,,,,,,,,,,,,,,,,,,,,,,,
"though the service could be better (possibly due to more than one very large group in the house), it is very cordial and warm, as is the general clientele.",service,conflict,11,18,service,conflict,1465,ambience,conflict,,,,,,,,,,,,,,,,,,,,,,,,,,,,,,,,,,,,
"The decor in this place is very diner-ish and the kind of place you expect in the East Village - not romantic, just simple, small and sparse.",decor,positive,4,9,ambience,positive,2927,,,place,positive,58,63,,,,,,,,,,,,,,,,,,,,,,,,,,,,,,,,
This is a cute place and could be good but they need to get their act together.,place,positive,15,20,anecdotes/miscellaneous,conflict,1544,ambience,positive,,,,,,,,,,,,,,,,,,,,,,,,,,,,,,,,,,,,
The lox is always fresh too.,lox,positive,4,7,food,positive,2161,,,,,,,,,,,,,,,,,,,,,,,,,,,,,,,,,,,,,,
"Sure enough, exactly 30 minutes later we got the call and were seated promptly.",,,,,service,positive,3115,,,,,,,,,,,,,,,,,,,,,,,,,,,,,,,,,,,,,,
Service was very friendly.,Service,positive,0,7,service,positive,1341,,,,,,,,,,,,,,,,,,,,,,,,,,,,,,,,,,,,,,
So all I'm trying to say is this restaurant is by far the best thai food restaurant I've ever been to.,thai food,positive,63,72,food,positive,3468,anecdotes/miscellaneous,positive,,,,,,,,,,,,,,,,,,,,,,,,,,,,,,,,,,,,
Food was OK - fish was cooked well.,Food,neutral,0,4,food,positive,840,,,fish,positive,14,18,,,,,,,,,,,,,,,,,,,,,,,,,,,,,,,,
We actually left hungry and went across the street to Wo Hop at 15 Mott street for some good chinese food.,chinese food,positive,93,105,anecdotes/miscellaneous,negative,1011,food,positive,,,,,,,,,,,,,,,,,,,,,,,,,,,,,,,,,,,,
The duck confit is always amazing and the foie gras terrine with figs was out of this world.,foie gras terrine with figs,positive,42,69,food,positive,698,,,duck confit,positive,4,15,,,,,,,,,,,,,,,,,,,,,,,,,,,,,,,,
"The whole set up is truly unprofessional and I wish Cafe Noir would get some good staff, because despite the current one this is a great place.",staff,negative,82,87,service,negative,14,,,,,,,,,,,,,,,,,,,,,,,,,,,,,,,,,,,,,,
The service does sometimes lack focus and it is not ideal if you are in a hurry but I have never been treated rudely.,service,conflict,4,11,service,conflict,557,,,,,,,,,,,,,,,,,,,,,,,,,,,,,,,,,,,,,,
The staff offers impeccable service.,staff,positive,4,9,service,positive,3302,,,service,positive,28,35,,,,,,,,,,,,,,,,,,,,,,,,,,,,,,,,
The catch is that you are charged extra for ANYTHING that you leave on your plate so don't be a greedy pig!,,,,,anecdotes/miscellaneous,negative,1651,price,negative,,,,,,,,,,,,,,,,,,,,,,,,,,,,,,,,,,,,
We ended our great experience by having Gulab Jamun (dessert) recommended by the waiter.,Gulab Jamun (dessert),positive,40,61,food,positive,160,,,waiter,positive,81,87,,,,,,,,,,,,,,,,,,,,,,,,,,,,,,,,
wont come back again for sure!,,,,,anecdotes/miscellaneous,negative,1777,,,,,,,,,,,,,,,,,,,,,,,,,,,,,,,,,,,,,,
i went to utsav about a yr ago with my family.,,,,,anecdotes/miscellaneous,neutral,919,,,,,,,,,,,,,,,,,,,,,,,,,,,,,,,,,,,,,,
"This place doesn't compare with Mamoun's in terms of price, freshness, value, and consisent quality, but that's just my opinion.",price,negative,53,58,food,negative,2427,price,negative,freshness,negative,60,69,value,negative,71,76,quality,negative,92,99,,,,,,,,,,,,,,,,,,,,,,,,
"The place is sleek, modern and playfull and i will return again frequently.",place,positive,4,9,ambience,positive,2404,,,,,,,,,,,,,,,,,,,,,,,,,,,,,,,,,,,,,,
"I have known about this secret for the last 13 years, Emilio(the Godfather) has continued to serve food and wine for the gods at mortal prices.",food,positive,99,103,price,positive,116,food,positive,wine,positive,108,112,prices,positive,136,142,,,,,,,,,,,,,,,,,,,,,,,,,,,,
The brioche and lollies as party favors is a cute and sweet touch to a most memorable meal.,brioche and lollies,positive,4,23,food,positive,2008,,,meal,positive,86,90,,,,,,,,,,,,,,,,,,,,,,,,,,,,,,,,
"After being told that our party of three would be seated in 10 minutes and watching other parties (multiples of 2 and higher) seated for 40 minutes, the three of us were squished into a small 2-person table.",2-person table,negative,192,206,anecdotes/miscellaneous,negative,2206,service,negative,,,,,,,,,,,,,,,,,,,,,,,,,,,,,,,,,,,,
And the bill was outragous.,bill,negative,8,12,price,negative,1010,,,,,,,,,,,,,,,,,,,,,,,,,,,,,,,,,,,,,,
"The service was attentive, yet unimposing, the food was far better than many notorious restaurants in Midtown and the wine list is extensive and well priced.",service,conflict,4,11,food,positive,89,service,positive,food,positive,47,51,wine list,positive,118,127,priced,positive,150,156,,,,,,,,,,,,,price,positive,,,,,,,,,,
"Kind, attentive wait staff.",wait staff,positive,16,26,service,positive,2994,,,,,,,,,,,,,,,,,,,,,,,,,,,,,,,,,,,,,,
Bon appettite!!,,,,,anecdotes/miscellaneous,positive,879,,,,,,,,,,,,,,,,,,,,,,,,,,,,,,,,,,,,,,
Salads were fantastic.,Salads,positive,0,6,food,positive,2572,,,,,,,,,,,,,,,,,,,,,,,,,,,,,,,,,,,,,,
The owners and employees are friendly and their pizza is fantastic.,owners,positive,4,10,food,positive,1288,service,positive,employees,positive,15,24,pizza,positive,48,53,,,,,,,,,,,,,,,,,,,,,,,,,,,,
"La Rosa waltzes in, and I think they are doing it the best.",,,,,anecdotes/miscellaneous,positive,3604,,,,,,,,,,,,,,,,,,,,,,,,,,,,,,,,,,,,,,
"The food is yummy, especially their cooked-to-perfection mussels in spicy tomato sauce and their shoestring crispy fries.",food,positive,4,8,food,positive,1723,,,mussels in spicy tomato sauce,positive,57,86,fries,positive,115,120,,,,,,,,,,,,,,,,,,,,,,,,,,,,
The food is authentic Italian - delicious!,food,positive,4,8,food,positive,3491,,,,,,,,,,,,,,,,,,,,,,,,,,,,,,,,,,,,,,
"A great addition to Smith Street: finally, a place that's not pretentious and filled with women wearing Ugg boots.",,,,,anecdotes/miscellaneous,positive,3610,,,,,,,,,,,,,,,,,,,,,,,,,,,,,,,,,,,,,,
skip dessert.,dessert,negative,5,12,food,negative,2909,,,,,,,,,,,,,,,,,,,,,,,,,,,,,,,,,,,,,,
We spent $200 in this place and left hungry and very disappointed.,,,,,anecdotes/miscellaneous,negative,2656,price,negative,,,,,,,,,,,,,,,,,,,,,,,,,,,,,,,,,,,,
It is simply amazing.,,,,,anecdotes/miscellaneous,positive,2598,,,,,,,,,,,,,,,,,,,,,,,,,,,,,,,,,,,,,,
I complete the total bagel experience by having it lightly toasted.,bagel,positive,21,26,anecdotes/miscellaneous,neutral,3172,,,,,,,,,,,,,,,,,,,,,,,,,,,,,,,,,,,,,,
It was like the servers forgot that they actually worked there and instead wanted to hang out and be cool.,servers,negative,16,23,service,negative,1795,,,,,,,,,,,,,,,,,,,,,,,,,,,,,,,,,,,,,,
I liked this place the first time but doubt I will ever return.,,,,,anecdotes/miscellaneous,negative,2992,,,,,,,,,,,,,,,,,,,,,,,,,,,,,,,,,,,,,,
The service is good and ambience is good for a date or group outing.,service,positive,4,11,service,positive,3438,ambience,positive,ambience,positive,24,32,,,,,,,,,,,,,,,,,,,,,,,,,,,,,,,,
A great way to make some money is to buy a case of snapple from Costco and sell it right outside for only $2.50.,case of snapple,neutral,43,58,anecdotes/miscellaneous,neutral,1276,,,,,,,,,,,,,,,,,,,,,,,,,,,,,,,,,,,,,,
It's all about the food !!,food,positive,19,23,food,positive,730,,,,,,,,,,,,,,,,,,,,,,,,,,,,,,,,,,,,,,
Fast service.,service,positive,5,12,service,positive,1870,,,,,,,,,,,,,,,,,,,,,,,,,,,,,,,,,,,,,,
"Skip this restaurant, it's a big disappointment.",,,,,anecdotes/miscellaneous,negative,2367,,,,,,,,,,,,,,,,,,,,,,,,,,,,,,,,,,,,,,
"The staff is excellent, specjal: that girl behind the bar, european chic.",staff,positive,4,9,service,positive,1519,,,bar,neutral,54,57,,,,,,,,,,,,,,,,,,,,,,,,,,,,,,,,
"stick with the chicken, beef, and lamb dishes.",chicken,positive,15,22,food,positive,2904,,,beef,positive,24,28,lamb dishes,positive,34,45,,,,,,,,,,,,,,,,,,,,,,,,,,,,
"The service was bad, the food took to forever to come, we sat on the upper level.",service,negative,4,11,service,negative,1009,,,food,negative,25,29,,,,,,,,,,,,,,,,,,,,,,,,,,,,,,,,
"We a menu that rearely changes,e xcept for one or two specials, the quality and care they put in thier food in evident.",quality,positive,68,75,food,positive,2642,,,care,positive,80,84,food,positive,103,107,specials,neutral,54,62,,,,,,,,,,,,,,,,,,,,,,,,
ALWAYS full with tourists (especially because of it's close proximity to Rockefeller Center).,,,,,ambience,neutral,43,,,,,,,,,,,,,,,,,,,,,,,,,,,,,,,,,,,,,,
"The decor is nice, but more casual than fine dining.",decor,conflict,4,9,ambience,conflict,1460,,,,,,,,,,,,,,,,,,,,,,,,,,,,,,,,,,,,,,
This restaurant is a wonderful place to go many times and it is reasonably priced.,priced,positive,75,81,anecdotes/miscellaneous,positive,307,price,positive,,,,,,,,,,,,,,,,,,,,,,,,,,,,,,,,,,,,
"Bravo, Blue Hill!",,,,,anecdotes/miscellaneous,positive,860,,,,,,,,,,,,,,,,,,,,,,,,,,,,,,,,,,,,,,
"Conveniently located too, being right on Bedford ave.",,,,,anecdotes/miscellaneous,positive,2594,,,,,,,,,,,,,,,,,,,,,,,,,,,,,,,,,,,,,,
My friends and I came across this place while walking in the village.,,,,,anecdotes/miscellaneous,neutral,607,,,,,,,,,,,,,,,,,,,,,,,,,,,,,,,,,,,,,,
"Bottom line: B+ for the food, F for the service.",food,positive,24,28,food,positive,1338,service,negative,service,negative,40,47,,,,,,,,,,,,,,,,,,,,,,,,,,,,,,,,
The only thing the waiters don't do for you is wipe your chin when you leave.,waiters,positive,19,26,service,positive,1625,,,,,,,,,,,,,,,,,,,,,,,,,,,,,,,,,,,,,,
This place is to be avoided.,,,,,anecdotes/miscellaneous,negative,2665,,,,,,,,,,,,,,,,,,,,,,,,,,,,,,,,,,,,,,
"Stick to dimsum, not super overpriced noodles.",noodles,neutral,38,45,food,negative,2095,price,negative,dimsum,positive,9,15,,,,,,,,,,,,,,,,,,,,,,,,,,,,,,,,
The service is fine and they allow you to enjoy the view.,service,positive,4,11,service,positive,989,ambience,positive,view,positive,52,56,,,,,,,,,,,,,,,,,,,,,,,,,,,,,,,,
My sister says it reminds her of a restaurant run by high-school students who don't know what they are doing.,,,,,anecdotes/miscellaneous,negative,1803,,,,,,,,,,,,,,,,,,,,,,,,,,,,,,,,,,,,,,
"We, there were four of us, arrived at noon - the place was empty - and the staff acted like we were imposing on them and they were very rude.",staff,negative,75,80,service,negative,3047,,,,,,,,,,,,,,,,,,,,,,,,,,,,,,,,,,,,,,
"At 6:30, we were the third party there.",,,,,anecdotes/miscellaneous,neutral,850,,,,,,,,,,,,,,,,,,,,,,,,,,,,,,,,,,,,,,
delicious simple food in nice outdoor atmosphere.,food,positive,17,21,food,positive,2993,ambience,positive,atmosphere,positive,38,48,,,,,,,,,,,,,,,,,,,,,,,,,,,,,,,,
I will definetly be going back.,,,,,anecdotes/miscellaneous,positive,2596,,,,,,,,,,,,,,,,,,,,,,,,,,,,,,,,,,,,,,
"No, really.",,,,,anecdotes/miscellaneous,neutral,3602,,,,,,,,,,,,,,,,,,,,,,,,,,,,,,,,,,,,,,
"The food is good, but very expensive for the casualness of it.",food,conflict,4,8,food,conflict,3108,price,negative,,,,,,,,,,,,,,,,,,,,,,,,,,,,,,,,,,,,
The only fallback on this restaurant is the prices.,prices,negative,44,50,price,negative,3439,,,,,,,,,,,,,,,,,,,,,,,,,,,,,,,,,,,,,,
I've been to Naples 45 for dinner twice.,dinner,neutral,27,33,anecdotes/miscellaneous,neutral,1604,,,,,,,,,,,,,,,,,,,,,,,,,,,,,,,,,,,,,,
The hot and sour soup was unbearably hot and tasted of only pepper and nothing else.,soup,negative,17,21,food,negative,1440,,,pepper,negative,60,66,,,,,,,,,,,,,,,,,,,,,,,,,,,,,,,,
i love the pics of andy warhol when he used to frequent the place (he painted the ballato's sign in the window).,,,,,ambience,positive,101,,,,,,,,,,,,,,,,,,,,,,,,,,,,,,,,,,,,,,
Try sushimi cucumber roll.,sushimi cucumber roll,positive,4,25,food,positive,351,,,,,,,,,,,,,,,,,,,,,,,,,,,,,,,,,,,,,,
I'm saving up for my next visit.,,,,,anecdotes/miscellaneous,positive,2009,,,,,,,,,,,,,,,,,,,,,,,,,,,,,,,,,,,,,,
The food is delicious.,food,positive,4,8,food,positive,988,,,,,,,,,,,,,,,,,,,,,,,,,,,,,,,,,,,,,,
Their wines by the glass are a great accompaniment and you can eat like a king with wine for under $30.,wines by the glass,positive,6,24,food,positive,2963,price,positive,wine,neutral,84,88,,,,,,,,,,,,,,,,,,,,,,,,,,,,,,,,
This place has the the correct ambience and an excellent staff to make you feel like a guest and a friend at the same time.,place,positive,5,10,service,positive,3412,ambience,positive,ambience,positive,31,39,staff,positive,57,62,,,,,,,,,,,,,,,,,,,,,,,,,,,,
Amma is nothing special.,,,,,anecdotes/miscellaneous,negative,1311,,,,,,,,,,,,,,,,,,,,,,,,,,,,,,,,,,,,,,
Yeah Shanghai is also great but not quite as good -- they use the same amount of salt but without sweetness to balance out.,salt,negative,81,85,anecdotes/miscellaneous,neutral,246,food,neutral,,,,,,,,,,,,,,,,,,,,,,,,,,,,,,,,,,,,
"believe us, we've been eating sushi for over 15 yrs.",sushi,neutral,30,35,anecdotes/miscellaneous,neutral,1771,,,,,,,,,,,,,,,,,,,,,,,,,,,,,,,,,,,,,,
"Worth it for a special occasion, or any time!",,,,,anecdotes/miscellaneous,positive,1913,,,,,,,,,,,,,,,,,,,,,,,,,,,,,,,,,,,,,,
The atmosphere is much better than Sripraphai (more modern and sleek).,atmosphere,positive,4,14,ambience,positive,1394,,,,,,,,,,,,,,,,,,,,,,,,,,,,,,,,,,,,,,
I recommend to anyone who wants to dress up and impress the lady.,,,,,anecdotes/miscellaneous,positive,226,,,,,,,,,,,,,,,,,,,,,,,,,,,,,,,,,,,,,,
"The food is outstanding and the service is quick, friendly and very professional.",food,positive,4,8,food,positive,3642,service,positive,service,positive,32,39,,,,,,,,,,,,,,,,,,,,,,,,,,,,,,,,
"The bagels always warm, soft on the inside, crispy on the outside and enormous in size.",bagels,positive,4,10,food,positive,2159,,,,,,,,,,,,,,,,,,,,,,,,,,,,,,,,,,,,,,
