Consistently good Japanese Tapas.,Japanese Tapas,positive,18,32,food,positive,2811,,,,,,,,,,,,,,,,,,,,,,,,,,,,,,,,,,,,,,
No apologies during restaurant week.,,,,,anecdotes/miscellaneous,negative,2024,,,,,,,,,,,,,,,,,,,,,,,,,,,,,,,,,,,,,,
"My goodness, everything from the fish to the rice to the seaweed was absolutely amazing.",fish,positive,33,37,food,positive,3020,,,rice,positive,45,49,seaweed,positive,57,64,,,,,,,,,,,,,,,,,,,,,,,,,,,,
"This place started off a little iffy, but is now one of my favorite indian restaurants in NYC (and I'm indian, so I should know).",,,,,anecdotes/miscellaneous,conflict,3079,,,,,,,,,,,,,,,,,,,,,,,,,,,,,,,,,,,,,,
They also do a great job for restaurant week.,,,,,anecdotes/miscellaneous,positive,2716,,,,,,,,,,,,,,,,,,,,,,,,,,,,,,,,,,,,,,
I went to this restaurant with a woman that I met recently.,,,,,anecdotes/miscellaneous,neutral,746,,,,,,,,,,,,,,,,,,,,,,,,,,,,,,,,,,,,,,
"The dishes offered were unique, very tasty and fresh from the lamb sausages, sardines with biscuits, large whole shrimp to the amazing pistachio ice cream (the best and freshest I've ever had).",dishes,positive,4,10,food,positive,2912,,,lamb sausages,positive,62,75,sardines with biscuits,positive,77,99,large whole shrimp,positive,101,119,pistachio ice cream,positive,135,154,,,,,,,,,,,,,,,,,,,,
This is where the aforementioned line was.,,,,,anecdotes/miscellaneous,neutral,3566,,,,,,,,,,,,,,,,,,,,,,,,,,,,,,,,,,,,,,
The food is reliable and the price is moderate.,food,positive,4,8,food,positive,1702,price,neutral,price,neutral,29,34,,,,,,,,,,,,,,,,,,,,,,,,,,,,,,,,
"Aside from the bearded, courdoroy blazer professor type with the NYU student he's sleeping with that week, you see a strange mix of hipsters, frat boys, Will Smith types who need to be told they are black, bitter cougars who cant understand why they arent married yet....",,,,,ambience,neutral,199,,,,,,,,,,,,,,,,,,,,,,,,,,,,,,,,,,,,,,
"While the ambiance and atmosphere were great, the food and service could have been a lot better.",ambiance,positive,10,18,food,negative,882,service,negative,atmosphere,positive,23,33,food,negative,50,54,service,negative,59,66,,,,,,,,,,,,,ambience,positive,,,,,,,,,,
We always go there on the weekends and leave extremely full and satisfied.,,,,,anecdotes/miscellaneous,positive,2324,,,,,,,,,,,,,,,,,,,,,,,,,,,,,,,,,,,,,,
i dont how this place is still running.,,,,,anecdotes/miscellaneous,negative,2524,,,,,,,,,,,,,,,,,,,,,,,,,,,,,,,,,,,,,,
The server was really cool and served us our food and drinks with a smile.,server,positive,4,10,service,positive,628,,,food,neutral,45,49,drinks,neutral,54,60,served,positive,31,37,,,,,,,,,,,,,,,,,,,,,,,,
We were in search of food and stumbled on this block of Indian restaurants on East Sixth Street.,food,neutral,21,25,anecdotes/miscellaneous,neutral,3563,,,,,,,,,,,,,,,,,,,,,,,,,,,,,,,,,,,,,,
"Planet Thailand has always been a hit with me , I go there usually for the sushi, which is great , the thai food is excellent too .",sushi,positive,75,80,food,positive,727,,,thai food,positive,103,112,,,,,,,,,,,,,,,,,,,,,,,,,,,,,,,,
"Very excited to hear that short-term Chef Jason Narone has moved on, he truly was a low point of their Sterling track record.",Chef,negative,37,41,anecdotes/miscellaneous,negative,1925,,,,,,,,,,,,,,,,,,,,,,,,,,,,,,,,,,,,,,
Excellent experience.,,,,,anecdotes/miscellaneous,positive,2740,,,,,,,,,,,,,,,,,,,,,,,,,,,,,,,,,,,,,,
"Well worth the trip, close to City Hall and downtown subway stops.",,,,,anecdotes/miscellaneous,positive,3422,,,,,,,,,,,,,,,,,,,,,,,,,,,,,,,,,,,,,,
I had to share my table with a loud group of kids and the service was rude an unattentive.,service,negative,58,65,service,negative,3144,ambience,negative,table,negative,18,23,,,,,,,,,,,,,,,,,,,,,,,,,,,,,,,,
What more could you want?,,,,,anecdotes/miscellaneous,positive,2202,,,,,,,,,,,,,,,,,,,,,,,,,,,,,,,,,,,,,,
"If you are the type of person who likes being scared and entertained, this is a great place to go and eat.",,,,,anecdotes/miscellaneous,positive,618,,,,,,,,,,,,,,,,,,,,,,,,,,,,,,,,,,,,,,
"All in all, I don't see how you can go wrong.",,,,,anecdotes/miscellaneous,positive,1919,,,,,,,,,,,,,,,,,,,,,,,,,,,,,,,,,,,,,,
The sauce on the pizza is sooo good with garlic and fresh tomatoes and they don't skimp.,garlic,positive,41,47,food,positive,1487,,,fresh tomatoes,positive,52,66,sauce on the pizza,positive,4,22,,,,,,,,,,,,,,,,,,,,,,,,,,,,
"We recently decided to try this location, and to our delight, they have outdoor seating, perfect since I had my yorkie with me.",outdoor seating,positive,72,87,ambience,positive,2120,,,,,,,,,,,,,,,,,,,,,,,,,,,,,,,,,,,,,,
"My husband had the mesclun, salmon, and ice cream and he enjoyed all 3 courses.",mesclun,positive,19,26,food,positive,1868,,,salmon,positive,28,34,ice cream,positive,40,49,courses,positive,71,78,,,,,,,,,,,,,,,,,,,,,,,,
We were told that the wait was about twenty minutes and there would be no problem for our 8:00 pm curtain call.,wait,neutral,22,26,anecdotes/miscellaneous,neutral,770,,,,,,,,,,,,,,,,,,,,,,,,,,,,,,,,,,,,,,
The food is usually good but it certainly isn't a relaxing place to go.,food,positive,4,8,food,positive,2205,ambience,negative,place,negative,59,64,,,,,,,,,,,,,,,,,,,,,,,,,,,,,,,,
I'm told that it is open 24hrs which is good.,,,,,anecdotes/miscellaneous,positive,948,,,,,,,,,,,,,,,,,,,,,,,,,,,,,,,,,,,,,,
"Super friendly and knowledgable staff, fabulous bistro fare and a wonderful jazz brunch with great live jazz (the chilaquiles were awesome!",staff,positive,32,37,food,positive,1940,service,positive,bistro fare,positive,48,59,chilaquiles,positive,114,125,jazz brunch,positive,76,87,live jazz,positive,99,108,,,,,,,,,ambience,positive,,,,,,,,,,
The prices were fantastic.,prices,positive,4,10,price,positive,2451,,,,,,,,,,,,,,,,,,,,,,,,,,,,,,,,,,,,,,
What a great place!,,,,,anecdotes/miscellaneous,positive,56,,,,,,,,,,,,,,,,,,,,,,,,,,,,,,,,,,,,,,
"Still, any quibbles about the bill were off-set by the pour-your-own measures of liquers which were courtesey of the house...",bill,conflict,30,34,food,positive,1632,price,conflict,measures of liquers,positive,69,88,,,,,,,,,,,,,,,,,,,,,,,,,,,,,,,,
"The table service could have been a little more attentive but as someone who also works in the service industry, I understood they were busy.",table service,conflict,4,17,service,conflict,1961,,,service,neutral,95,102,,,,,,,,,,,,,,,,,,,,,,,,,,,,,,,,
"It's not mind-blowing, but to me, thai food never is and never will be.",thai food,neutral,34,43,food,neutral,710,,,,,,,,,,,,,,,,,,,,,,,,,,,,,,,,,,,,,,
"Food was very good as well, considering that we tried the budget selection (though I wish the pork belly that I ordered was roasted a bit longer, so that fat was more of a melt-in-your-mouth experience).",Food,positive,0,4,food,conflict,911,,,pork belly,negative,94,104,fat,negative,154,157,,,,,,,,,,,,,,,,,,,,,,,,,,,,
"Although, one night we went it was super cheesy, and another night it was less cheesy.",,,,,food,conflict,3607,,,,,,,,,,,,,,,,,,,,,,,,,,,,,,,,,,,,,,
"Even though it is a little loud, you don't have to yell at each other to talk.",,,,,ambience,conflict,1955,,,,,,,,,,,,,,,,,,,,,,,,,,,,,,,,,,,,,,
"i've been to sapphire twice and both times the food was fine, if not good.",food,positive,47,51,food,positive,2903,,,,,,,,,,,,,,,,,,,,,,,,,,,,,,,,,,,,,,
It is kinda nosiy and the tables are close together but it's still a beautiful place to enjoy a nice dinner.,tables,negative,26,32,ambience,conflict,1887,,,dinner,positive,101,107,place,positive,79,84,,,,,,,,,,,,,,,,,,,,,,,,,,,,
Was surprisingly disappointed.,,,,,anecdotes/miscellaneous,negative,3495,,,,,,,,,,,,,,,,,,,,,,,,,,,,,,,,,,,,,,
I love the fact that the pizza tastes so good and is so cheap.,pizza,positive,25,30,food,positive,1273,price,positive,,,,,,,,,,,,,,,,,,,,,,,,,,,,,,,,,,,,
Nicky the Nose at the bar is a treat.,bar,neutral,22,25,service,positive,590,,,,,,,,,,,,,,,,,,,,,,,,,,,,,,,,,,,,,,
I went to Ruby Foo's after work with a group of 6.,,,,,anecdotes/miscellaneous,neutral,762,,,,,,,,,,,,,,,,,,,,,,,,,,,,,,,,,,,,,,
I'm amazed we haven't been kicked out of this place yet.,,,,,anecdotes/miscellaneous,neutral,3374,,,,,,,,,,,,,,,,,,,,,,,,,,,,,,,,,,,,,,
"Service was prompt, friendly and great.",Service,positive,0,7,service,positive,179,,,,,,,,,,,,,,,,,,,,,,,,,,,,,,,,,,,,,,
"I haven't eat a lamb chop as delicious as that,the salads are really nice dressed with lemon and extra virgnin olive oil.",lamb chop,positive,16,25,food,positive,109,,,salads,positive,51,57,lemon,positive,87,92,extra virgnin olive oil,positive,97,120,,,,,,,,,,,,,,,,,,,,,,,,
The sushi was awful!,sushi,negative,4,9,food,negative,339,,,,,,,,,,,,,,,,,,,,,,,,,,,,,,,,,,,,,,
Katz's has been a NYC original for over 100 years.,,,,,anecdotes/miscellaneous,positive,489,,,,,,,,,,,,,,,,,,,,,,,,,,,,,,,,,,,,,,
You can get an excellent meal at most of the many Indian restaurants on nearby Lexington Avenue for the cost of one the dainty dishes here.,meal,positive,25,29,price,negative,2487,,,cost,conflict,104,108,dishes,positive,127,133,,,,,,,,,,,,,,,,,,,,,,,,,,,,
"The Pastrami sandwich was like buttah and with pickles and an icy cold beer to wash it down, it was a pleasurable experience.",Pastrami sandwich,positive,4,21,food,positive,499,,,beer,positive,71,75,pickles,positive,47,54,,,,,,,,,,,,,,,,,,,,,,,,,,,,
The plain pizza was soggy and the creative wild mushroom(third generation-Fornini) pizza we had was drenched with truffle oil in the middle( again making it soggy) and nothingon the rest.,plain pizza,negative,4,15,food,negative,2589,,,truffle oil,neutral,114,125,wild mushroom(third generation-Fornini) pizza,positive,43,88,,,,,,,,,,,,,,,,,,,,,,,,,,,,
"Late nite omelletes are not good here, there is no variety!",omelletes,negative,10,19,food,negative,3701,,,,,,,,,,,,,,,,,,,,,,,,,,,,,,,,,,,,,,
Everything at Sala Thai is tasty and well-portioned.,,,,,food,positive,381,,,,,,,,,,,,,,,,,,,,,,,,,,,,,,,,,,,,,,
"After all that, they complained to me about the small tip.",tip,negative,54,57,service,negative,3050,,,,,,,,,,,,,,,,,,,,,,,,,,,,,,,,,,,,,,
It's a great place to pick up a cheap lunch or dinner.,lunch,positive,38,43,price,positive,1185,,,dinner,positive,47,53,,,,,,,,,,,,,,,,,,,,,,,,,,,,,,,,
"Behind this counter, two men are squeezed in.",counter,negative,12,19,ambience,negative,1555,,,,,,,,,,,,,,,,,,,,,,,,,,,,,,,,,,,,,,
Great find!!!,,,,,anecdotes/miscellaneous,positive,1112,,,,,,,,,,,,,,,,,,,,,,,,,,,,,,,,,,,,,,
"If only they delivered, they'd make a mint!",,,,,anecdotes/miscellaneous,positive,3368,,,,,,,,,,,,,,,,,,,,,,,,,,,,,,,,,,,,,,
"Whenever you need a Sushi fix, Mizu will be there with quality fish and great service.",fish,positive,63,67,food,positive,1032,service,positive,service,positive,78,85,Sushi fix,positive,20,29,,,,,,,,,,,,,,,,,,,,,,,,,,,,
"Our waitress was sweet and accomodating, not overbearing.",waitress,positive,4,12,service,positive,1124,,,,,,,,,,,,,,,,,,,,,,,,,,,,,,,,,,,,,,
Went there with my wife and we had to wait for a table even though you could see there many that were empty with not reservation sigh on them.,reservation sigh,neutral,117,133,service,negative,1663,,,table,negative,49,54,,,,,,,,,,,,,,,,,,,,,,,,,,,,,,,,
I was really disappointed ant wanted to tell everyone not to go eat or even take out food from there.,food,negative,85,89,anecdotes/miscellaneous,negative,1690,,,,,,,,,,,,,,,,,,,,,,,,,,,,,,,,,,,,,,
The website and rating makes this place look wonderful but in reality it was very disappointing.,place,conflict,34,39,ambience,conflict,788,anecdotes/miscellaneous,conflict,,,,,,,,,,,,,,,,,,,,,,,,,,,,,,,,,,,,
"Despite a slightly limited menu, everything prepared is done to perfection, ultra fresh and a work of food art.",menu,negative,27,31,food,conflict,1780,,,food art,positive,102,110,,,,,,,,,,,,,,,,,,,,,,,,,,,,,,,,
The outdoor atmosphere of sitting on the sidewalk watching the world go by 50 feet away on 6th avenue on a cool evening was wonderful.,outdoor atmosphere,positive,4,22,ambience,positive,742,,,,,,,,,,,,,,,,,,,,,,,,,,,,,,,,,,,,,,
"A large is $20, and toppings are about $3 each.",toppings,neutral,20,28,price,negative,1471,,,,,,,,,,,,,,,,,,,,,,,,,,,,,,,,,,,,,,
"In any event, this is a place I'll be sure to stop by again when I'm in this part of town.",,,,,anecdotes/miscellaneous,positive,1789,,,,,,,,,,,,,,,,,,,,,,,,,,,,,,,,,,,,,,
I definitely wouldn't go back.,,,,,anecdotes/miscellaneous,negative,2751,,,,,,,,,,,,,,,,,,,,,,,,,,,,,,,,,,,,,,
It is not worth for that bucks.,,,,,price,negative,1189,,,,,,,,,,,,,,,,,,,,,,,,,,,,,,,,,,,,,,
brick oven gallery is My pick for best pizza restaurant anywhere.,pizza,positive,39,44,anecdotes/miscellaneous,positive,3352,,,,,,,,,,,,,,,,,,,,,,,,,,,,,,,,,,,,,,
Add to that great service and great food at a reasonable price and you have yourself the beginning of a great evening.,service,positive,18,25,food,positive,3315,price,positive,food,positive,36,40,price,positive,57,62,,,,,,,,,,,,,,,,,service,positive,,,,,,,,,,
"For many people, this may not seem like Aunthentic Thai food because most places in NYC arent quite authentic.",Thai food,negative,51,60,food,negative,3393,,,,,,,,,,,,,,,,,,,,,,,,,,,,,,,,,,,,,,
"Growing up in NY, I have eaten my share of bagels.",bagels,neutral,43,49,anecdotes/miscellaneous,neutral,2157,,,,,,,,,,,,,,,,,,,,,,,,,,,,,,,,,,,,,,
"Oh, don't even let me start with how expensive the bills were!",bills,negative,51,56,price,negative,3018,,,,,,,,,,,,,,,,,,,,,,,,,,,,,,,,,,,,,,
A hearty two thumbs up!,,,,,anecdotes/miscellaneous,positive,1401,,,,,,,,,,,,,,,,,,,,,,,,,,,,,,,,,,,,,,
The scallion pancakes and fried dumplings were nothing out of the ordinary.,scallion pancakes,neutral,4,21,food,neutral,257,,,fried dumplings,neutral,26,41,,,,,,,,,,,,,,,,,,,,,,,,,,,,,,,,
"All the appetizers and salads were fabulous, the steak was mouth watering and the pasta was delicious!!!",appetizers,positive,8,18,food,positive,813,,,salads,positive,23,29,steak,positive,49,54,pasta,positive,82,87,,,,,,,,,,,,,,,,,,,,,,,,
"Besides having the table we had been promised given to other restaurant patrons twice before we were actually seated, we were served dishes we hadn't ordered three times, received one of our orders 20 minutes after the rest of the table had been served (and that order was undercooked), and charged $45 more than we should have been on our bill.",table,negative,19,24,service,negative,2862,price,negative,served,negative,126,132,dishes,negative,133,139,table,negative,231,236,served,negative,246,252,bill,negative,340,344,,,,,,,,,,,,,,,,
Service is top notch.,Service,positive,0,7,service,positive,3292,,,,,,,,,,,,,,,,,,,,,,,,,,,,,,,,,,,,,,
The food now is inconsistent.,food,negative,4,8,food,negative,3343,,,,,,,,,,,,,,,,,,,,,,,,,,,,,,,,,,,,,,
All pretty good.,,,,,anecdotes/miscellaneous,positive,3045,,,,,,,,,,,,,,,,,,,,,,,,,,,,,,,,,,,,,,
"You can also special order any kind of dumpling,etc.",dumpling,positive,39,47,anecdotes/miscellaneous,positive,3135,,,,,,,,,,,,,,,,,,,,,,,,,,,,,,,,,,,,,,
you guys rock.,,,,,anecdotes/miscellaneous,positive,3391,,,,,,,,,,,,,,,,,,,,,,,,,,,,,,,,,,,,,,
Chance is a joke.,,,,,anecdotes/miscellaneous,negative,3651,,,,,,,,,,,,,,,,,,,,,,,,,,,,,,,,,,,,,,
I was pretty much full after our fondue appetizer.,fondue appetizer,neutral,33,49,food,positive,2018,anecdotes/miscellaneous,positive,,,,,,,,,,,,,,,,,,,,,,,,,,,,,,,,,,,,
BE CAREFUL before you request extra spice.,spice,neutral,36,41,food,neutral,3551,,,,,,,,,,,,,,,,,,,,,,,,,,,,,,,,,,,,,,
The octopus eaters were floored by the Octopus salad.,Octopus salad,positive,39,52,food,positive,2355,,,,,,,,,,,,,,,,,,,,,,,,,,,,,,,,,,,,,,
We thought that this place is using too much of MSG cooking in the foods.,foods,negative,67,72,food,negative,3178,,,MSG cooking,negative,48,59,,,,,,,,,,,,,,,,,,,,,,,,,,,,,,,,
I was at Rao's last Wed.,,,,,anecdotes/miscellaneous,neutral,586,,,,,,,,,,,,,,,,,,,,,,,,,,,,,,,,,,,,,,
And the Tom Kha soup was pathetic.,Tom Kha soup,negative,8,20,food,negative,2211,,,,,,,,,,,,,,,,,,,,,,,,,,,,,,,,,,,,,,
I started out with a Bombay beer which was big enough for two.,Bombay beer,positive,21,32,food,positive,2317,,,,,,,,,,,,,,,,,,,,,,,,,,,,,,,,,,,,,,
"The decor is vibrant and eye-pleasing with several semi-private boths on the right side of the dining hall, which are great for a date.",decor,positive,4,9,ambience,positive,175,,,dining hall,positive,95,106,semi-private boths,positive,51,69,,,,,,,,,,,,,,,,,,,,,,,,,,,,
Service was quick.,Service,positive,0,7,service,positive,1609,,,,,,,,,,,,,,,,,,,,,,,,,,,,,,,,,,,,,,
Tends to turn people away.,,,,,anecdotes/miscellaneous,negative,2706,,,,,,,,,,,,,,,,,,,,,,,,,,,,,,,,,,,,,,
We thought this a prelude to what the evening will be like.,,,,,anecdotes/miscellaneous,neutral,1860,,,,,,,,,,,,,,,,,,,,,,,,,,,,,,,,,,,,,,
"I was turned on to this restaurant by a fellow foodie friend of mine, and have been going back regularly ever since.",,,,,anecdotes/miscellaneous,positive,961,,,,,,,,,,,,,,,,,,,,,,,,,,,,,,,,,,,,,,
Drawbacks: service is slow and they don't toast!,service,negative,11,18,service,negative,1057,,,,,,,,,,,,,,,,,,,,,,,,,,,,,,,,,,,,,,
Went there for an office lunch.,office lunch,neutral,18,30,anecdotes/miscellaneous,neutral,3188,,,,,,,,,,,,,,,,,,,,,,,,,,,,,,,,,,,,,,
I have been doing all of the above at the Heartland Brewery for over 5 years now and I HAVE NEVER BEEN DISAPPOINTED!,,,,,anecdotes/miscellaneous,positive,65,,,,,,,,,,,,,,,,,,,,,,,,,,,,,,,,,,,,,,
"Everytime I decide to try another place on the UES, I get angry that I didn't just go to Zucchero Pomodori.",,,,,anecdotes/miscellaneous,conflict,2735,,,,,,,,,,,,,,,,,,,,,,,,,,,,,,,,,,,,,,
The sweet lassi was excellent as was the lamb chettinad and the garlic naan but the rasamalai was forgettable.,sweet lassi,positive,4,15,food,conflict,2882,,,lamb chettinad,positive,41,55,garlic naan,positive,64,75,rasamalai,negative,84,93,,,,,,,,,,,,,,,,,,,,,,,,
"We've been following chef Lyle's food around New York for 15 years and while remaining classic, his innovations with bistro fare have made us return and return.",bistro fare,positive,117,128,food,positive,1948,,,chef,positive,21,25,food,positive,33,37,,,,,,,,,,,,,,,,,,,,,,,,,,,,
The best thing I tasted were the lambchops.,lambchops,positive,33,42,food,positive,2041,,,,,,,,,,,,,,,,,,,,,,,,,,,,,,,,,,,,,,
it's delicious!,,,,,food,positive,1046,,,,,,,,,,,,,,,,,,,,,,,,,,,,,,,,,,,,,,
The spicy tuna and salmon are the best we've ever had.,spicy tuna,positive,4,14,food,positive,1656,,,salmon,positive,19,25,,,,,,,,,,,,,,,,,,,,,,,,,,,,,,,,
"Even though its good seafood, the prices are too high.",seafood,positive,21,28,food,positive,3440,price,negative,prices,negative,34,40,,,,,,,,,,,,,,,,,,,,,,,,,,,,,,,,
"In addition, the food is very good and the prices are reasonable.",food,positive,17,21,food,positive,870,price,positive,prices,positive,43,49,,,,,,,,,,,,,,,,,,,,,,,,,,,,,,,,
"Upon entering, we were greeted by the owners, Steven and Frederick, who went out of their way to be more than gracious hosts.",owners,positive,38,44,service,positive,2986,,,hosts,positive,119,124,,,,,,,,,,,,,,,,,,,,,,,,,,,,,,,,
"If you live outside the neighborhood, don't bother!",,,,,anecdotes/miscellaneous,negative,288,,,,,,,,,,,,,,,,,,,,,,,,,,,,,,,,,,,,,,
Been going here since it opened have seen the quality value decrease considerably.,quality value,negative,46,59,anecdotes/miscellaneous,negative,284,,,,,,,,,,,,,,,,,,,,,,,,,,,,,,,,,,,,,,
"Meat dishes now adorn the selections, although there's still a large number of vegetarian-friendly choices.",Meat dishes,neutral,0,11,food,neutral,3418,,,vegetarian-friendly choices,positive,79,106,,,,,,,,,,,,,,,,,,,,,,,,,,,,,,,,
I never had anything I didn't like here.,,,,,anecdotes/miscellaneous,positive,3358,,,,,,,,,,,,,,,,,,,,,,,,,,,,,,,,,,,,,,
Reasonable prices.,prices,positive,11,17,price,positive,83,,,,,,,,,,,,,,,,,,,,,,,,,,,,,,,,,,,,,,
they bring service up a notch by offerng complementary amuse bouche to all tables and gave us a small dessert for our celebration.,amuse bouche,positive,55,67,service,positive,2940,,,dessert,positive,102,109,tables,positive,75,81,service,positive,11,18,,,,,,,,,,,,,,,,,,,,,,,,
"Try the crunchy tuna, it is to die for.",crunchy tuna,positive,8,20,food,positive,2141,,,,,,,,,,,,,,,,,,,,,,,,,,,,,,,,,,,,,,
It won't break the bank but I also wouldnt come back for the food.,food,negative,61,65,food,negative,1854,price,conflict,,,,,,,,,,,,,,,,,,,,,,,,,,,,,,,,,,,,
"All in all, this midtown gem instantly became one of my favorite sushi restaurants in the city.",sushi,positive,65,70,anecdotes/miscellaneous,positive,396,,,,,,,,,,,,,,,,,,,,,,,,,,,,,,,,,,,,,,
I've been to Joya twice and I will never go again.,,,,,anecdotes/miscellaneous,negative,3471,,,,,,,,,,,,,,,,,,,,,,,,,,,,,,,,,,,,,,
So rushing us out was absolutely unnecessary!,,,,,anecdotes/miscellaneous,negative,3577,,,,,,,,,,,,,,,,,,,,,,,,,,,,,,,,,,,,,,
However it is the ONLY Taiwanese restaurant in town.,,,,,anecdotes/miscellaneous,neutral,2283,,,,,,,,,,,,,,,,,,,,,,,,,,,,,,,,,,,,,,
It is a lot of fun with live entertainment and all kinds of Disney type special effects.,live entertainment,positive,24,42,ambience,positive,614,,,special effects,positive,72,87,,,,,,,,,,,,,,,,,,,,,,,,,,,,,,,,
"if you're looking for perfect traditional sushi, go here - if you're looking for interesting combinations, try sushi of gari's (east side).",sushi,positive,42,47,food,positive,3012,,,sushi,positive,111,116,,,,,,,,,,,,,,,,,,,,,,,,,,,,,,,,
"No refills on fountain drinks, though.",fountain drinks,negative,14,29,food,negative,2621,,,,,,,,,,,,,,,,,,,,,,,,,,,,,,,,,,,,,,
Wow over 100 beers to choose from.,beers,positive,13,18,food,positive,605,,,,,,,,,,,,,,,,,,,,,,,,,,,,,,,,,,,,,,
Be careful of portions - they're HUGE.,portions,positive,14,22,food,positive,2017,,,,,,,,,,,,,,,,,,,,,,,,,,,,,,,,,,,,,,
"The Steak Tartare is a great bet, they fix it for you at the table.",Steak Tartare,positive,4,17,food,positive,2974,,,,,,,,,,,,,,,,,,,,,,,,,,,,,,,,,,,,,,
My first time there I happened not to like the Crab Croquette apt that i ordered and they were happy to change it for me without making no big deal.,Crab Croquette apt,negative,47,65,service,positive,2456,food,negative,,,,,,,,,,,,,,,,,,,,,,,,,,,,,,,,,,,,
Great for large groups and celebrations - our SUPER HAPPY waiter was the entertainment of the evening.,waiter,positive,58,64,service,positive,25,anecdotes/miscellaneous,positive,,,,,,,,,,,,,,,,,,,,,,,,,,,,,,,,,,,,
Did I mention the wine?,wine,neutral,18,22,food,neutral,520,,,,,,,,,,,,,,,,,,,,,,,,,,,,,,,,,,,,,,
"Plus, on Wednesday nights the house wine is unlimited!",house wine,positive,30,40,food,positive,3383,,,,,,,,,,,,,,,,,,,,,,,,,,,,,,,,,,,,,,
It is by far my favorite restaurant in Brooklyn.,,,,,anecdotes/miscellaneous,positive,2186,,,,,,,,,,,,,,,,,,,,,,,,,,,,,,,,,,,,,,
Now it's so crowded and loud you can't even talk to the person next to you.,,,,,ambience,negative,3478,,,,,,,,,,,,,,,,,,,,,,,,,,,,,,,,,,,,,,
Love Pizza 33..,,,,,anecdotes/miscellaneous,positive,1283,,,,,,,,,,,,,,,,,,,,,,,,,,,,,,,,,,,,,,
Even my Indian friend couldn't believe how good and tasty everything was.,,,,,food,positive,3411,,,,,,,,,,,,,,,,,,,,,,,,,,,,,,,,,,,,,,
"I'm from England, and Haru's was the best I had in NYC.",,,,,anecdotes/miscellaneous,positive,3221,,,,,,,,,,,,,,,,,,,,,,,,,,,,,,,,,,,,,,
Less = More in their case.,,,,,anecdotes/miscellaneous,positive,1923,,,,,,,,,,,,,,,,,,,,,,,,,,,,,,,,,,,,,,
Ruby Foo's is a tourist trap.,,,,,anecdotes/miscellaneous,negative,756,,,,,,,,,,,,,,,,,,,,,,,,,,,,,,,,,,,,,,
I've been here a couple of times and have not been impressed.,,,,,anecdotes/miscellaneous,negative,1194,,,,,,,,,,,,,,,,,,,,,,,,,,,,,,,,,,,,,,
I've been many time and have never been disappointed.,,,,,anecdotes/miscellaneous,positive,3372,,,,,,,,,,,,,,,,,,,,,,,,,,,,,,,,,,,,,,
Ciao Bella,,,,,anecdotes/miscellaneous,neutral,123,,,,,,,,,,,,,,,,,,,,,,,,,,,,,,,,,,,,,,
like saying her bread comes from a special bakery when we have seen her buying it dowtown manhathan.,bread,negative,16,21,food,negative,2522,service,negative,,,,,,,,,,,,,,,,,,,,,,,,,,,,,,,,,,,,
The dim sum servings here are a bit larger than I'm used to.,dim sum servings,neutral,4,20,food,neutral,2386,,,,,,,,,,,,,,,,,,,,,,,,,,,,,,,,,,,,,,
"However, in the summer of 2003, it seems the management has changed and the great big door has been replaced for a glass front ridding itself of the dark romantic getup.",management,neutral,45,55,service,neutral,3332,ambience,negative,door,positive,86,90,glass front,negative,115,126,,,,,,,,,,,,,,,,,,,,,,,,,,,,
We won't go to this place again for a good meal.,meal,negative,43,47,food,negative,717,,,,,,,,,,,,,,,,,,,,,,,,,,,,,,,,,,,,,,
It's a much more grown up restaurant compared to the rest of the street.,,,,,ambience,neutral,680,,,,,,,,,,,,,,,,,,,,,,,,,,,,,,,,,,,,,,
"Barbecued codfish was gorgeously moist - as if poached - yet the fabulous texture was let down by curiously bland seasoning - a spice rub might have overwhelmed, however herb mix or other sauce would have done much to enhance.",Barbecued codfish,positive,0,17,food,conflict,1345,,,seasoning,negative,114,123,texture,conflict,74,81,spice rub,negative,128,137,herb mix,negative,170,178,sauce,negative,188,193,,,,,,,,,,,,,,,,
We were treated with attitude ever since the moment we stepped into the restaurant!,,,,,service,negative,3013,,,,,,,,,,,,,,,,,,,,,,,,,,,,,,,,,,,,,,
"After dinner, take your date to the HUGE dance floor, probably one of the biggest you'll see in NY.",dance floor,positive,41,52,ambience,positive,1159,,,dinner,neutral,6,12,,,,,,,,,,,,,,,,,,,,,,,,,,,,,,,,
Taj Mahal offeres gret value and great food.,value,positive,23,28,food,positive,3547,price,positive,food,positive,39,43,,,,,,,,,,,,,,,,,,,,,,,,,,,,,,,,
